{
  "schema_version": "1.0.0",
  "payload_type": "screenshot_manifest",
  "vertical": "fintech",
  "screenshots": [
    {
      "artifact_id": "fintech_3_dashboard_001",
      "vertical": "fintech",
      "month": 3,
      "type": "dashboard",
      "url": "",
      "alt_text": "Fintech audit dashboard — Month 3"
    },
    {
      "artifact_id": "fintech_3_report_001",
      "vertical": "fintech",
      "month": 3,
      "type": "report",
      "url": "https://demo.bayesiq.com/screenshots/fintech/month-3-report.png",
      "alt_text": "Fintech audit report — Month 3"
    }
  ]
}
