{
  "schema_version": "1.0.0",
  "payload_type": "screenshot_manifest",
  "vertical": "retail",
  "screenshots": [
    {
      "artifact_id": "retail_3_dashboard_001",
      "vertical": "retail",
      "month": 3,
      "type": "dashboard",
      "url": "",
      "alt_text": "Retail audit dashboard — Month 3"
    },
    {
      "artifact_id": "retail_3_report_001",
      "vertical": "retail",
      "month": 3,
      "type": "report",
      "url": "https://demo.bayesiq.com/screenshots/retail/month-3-report.png",
      "alt_text": "Retail audit report — Month 3"
    }
  ]
}
